{"product_name":"EZn이지엔 위생 롤백 소형 17cm x 25cm 200매 + 중형 25cm x 35cm 200매 + 대형 30cm x 40cm 200매","shop_name":"EZn이지엔","price_text":"9,900원","price_value":9900,"product_image_bbox":{"x":94,"y":267,"width":573,"height":403},"confidence":{"product_name":0.97,"shop_name":0.94,"price":0.9,"product_image_bbox":0.72},"warnings":["대표 가격으로 보이는 값이 9,900원이지만 화면에 일반판매가 10,880원과 기준가 20,600원도 함께 표시됩니다.","shop_name은 쇼핑몰명 쿠팡이 아니라 화면의 브랜드명 EZn이지엔으로 추출했습니다.","상품 이미지 bbox는 대표 상품 사진 영역을 기준으로 추정했습니다."]}